{
  "schema_version": "galatea-task-snapshot/v1",
  "task": {
    "id": "task_data_demo",
    "title": "CSV 清洗与质量报告",
    "goal": "检查并清洗 CSV，去重后输出数据与报告，不训练模型。",
    "status": "completed",
    "version": 9,
    "plan_revision": 1,
    "control_epoch": 0,
    "binding_id": "binding_demo",
    "workspace_ref": "workspace_demo",
    "constraints": {
      "scope": "data_processing",
      "allow_training": false,
      "max_auto_continuations": 20,
      "deadline_at": "2026-10-20T03:00:00Z"
    },
    "completion_conditions": [
      {
        "id": "goal_dataset",
        "type": "artifact_exists",
        "parameters": {
          "artifact_role": "clean_dataset"
        },
        "state": "passed",
        "evidence_refs": [
          "evidence_clean"
        ]
      },
      {
        "id": "goal_report",
        "type": "artifact_exists",
        "parameters": {
          "artifact_role": "quality_report"
        },
        "state": "passed",
        "evidence_refs": [
          "evidence_clean"
        ]
      }
    ],
    "plan_summary": "两个阶段完成数据处理与交付。",
    "created_at": "2026-10-19T03:00:00Z",
    "updated_at": "2026-10-19T03:02:00Z"
  },
  "stages": [
    {
      "id": "stage_inspect",
      "kind": "data.inspect",
      "title": "检查数据",
      "status": "completed",
      "required": true,
      "depends_on": [],
      "input_refs": [
        "dataset_input_v1"
      ],
      "acceptance": [
        {
          "id": "inspect_report",
          "type": "artifact_exists",
          "parameters": {
            "artifact_role": "inspection_report"
          },
          "state": "passed",
          "evidence_refs": [
            "evidence_inspect"
          ]
        }
      ],
      "evidence_refs": [
        "evidence_inspect"
      ],
      "artifact_refs": [
        "artifact_inspection"
      ],
      "current_attempt": {
        "id": "attempt_inspect_1",
        "number": 1,
        "status": "succeeded",
        "execution_scope_id": "scope_attempt_inspect_1",
        "started_at": "2026-10-19T03:00:00Z",
        "ended_at": "2026-10-19T03:01:00Z"
      },
      "result": {
        "rows": 10000,
        "duplicate_rows": 120,
        "encoding": "UTF-8"
      }
    },
    {
      "id": "stage_clean",
      "kind": "data.transform",
      "title": "清洗并交付",
      "status": "completed",
      "required": true,
      "depends_on": [
        "stage_inspect"
      ],
      "input_refs": [
        "dataset_input_v1",
        "artifact_inspection"
      ],
      "acceptance": [
        {
          "id": "clean_dataset",
          "type": "artifact_exists",
          "parameters": {
            "artifact_role": "clean_dataset"
          },
          "state": "passed",
          "evidence_refs": [
            "evidence_clean"
          ]
        },
        {
          "id": "clean_report",
          "type": "artifact_exists",
          "parameters": {
            "artifact_role": "quality_report"
          },
          "state": "passed",
          "evidence_refs": [
            "evidence_clean"
          ]
        }
      ],
      "evidence_refs": [
        "evidence_clean"
      ],
      "artifact_refs": [
        "artifact_dataset",
        "artifact_report"
      ],
      "current_attempt": {
        "id": "attempt_clean_1",
        "number": 1,
        "status": "succeeded",
        "execution_scope_id": "scope_attempt_clean_1",
        "started_at": "2026-10-19T03:01:00Z",
        "ended_at": "2026-10-19T03:02:00Z"
      },
      "result": {
        "input_rows": 10000,
        "output_rows": 9880,
        "removed_duplicates": 120
      }
    }
  ],
  "artifacts": [
    {
      "id": "artifact_inspection",
      "kind": "inspection_report",
      "display_name": "inspection.json",
      "media_type": "application/json",
      "size_bytes": 1024,
      "sha256": "aaaaaaaaaaaaaaaaaaaaaaaaaaaaaaaaaaaaaaaaaaaaaaaaaaaaaaaaaaaaaaaa",
      "locator_ref": "locator_artifact_inspection",
      "created_at": "2026-10-19T03:01:00Z"
    },
    {
      "id": "artifact_dataset",
      "kind": "clean_dataset",
      "display_name": "clean.csv",
      "media_type": "text/csv",
      "size_bytes": 262144,
      "sha256": "bbbbbbbbbbbbbbbbbbbbbbbbbbbbbbbbbbbbbbbbbbbbbbbbbbbbbbbbbbbbbbbb",
      "locator_ref": "locator_artifact_dataset",
      "created_at": "2026-10-19T03:02:00Z"
    },
    {
      "id": "artifact_report",
      "kind": "quality_report",
      "display_name": "quality.json",
      "media_type": "application/json",
      "size_bytes": 2048,
      "sha256": "cccccccccccccccccccccccccccccccccccccccccccccccccccccccccccccccc",
      "locator_ref": "locator_artifact_report",
      "created_at": "2026-10-19T03:02:00Z"
    }
  ],
  "evidence": [
    {
      "id": "evidence_inspect",
      "source": "artifact_verifier",
      "verification": "verified",
      "sha256": "dddddddddddddddddddddddddddddddddddddddddddddddddddddddddddddddd",
      "observed_at": "2026-10-19T03:01:00Z",
      "artifact_refs": [
        "artifact_inspection"
      ],
      "operation_refs": [],
      "summary": "示例：检查报告存在且符合登记 Schema。",
      "verifier_version": "artifact-verifier/v1"
    },
    {
      "id": "evidence_clean",
      "source": "artifact_verifier",
      "verification": "verified",
      "sha256": "eeeeeeeeeeeeeeeeeeeeeeeeeeeeeeeeeeeeeeeeeeeeeeeeeeeeeeeeeeeeeeee",
      "observed_at": "2026-10-19T03:02:00Z",
      "artifact_refs": [
        "artifact_dataset",
        "artifact_report"
      ],
      "operation_refs": [],
      "summary": "示例：产物与清单匹配，清洗规则验收通过。",
      "verifier_version": "artifact-verifier/v1"
    }
  ],
  "external_operations": [],
  "allowed_actions": [
    "explain",
    "download"
  ],
  "last_event_seq": 18
}
