{
  "schema_version": "galatea-task-snapshot/v1",
  "task": {
    "id": "task_training_demo",
    "title": "预授权模型训练",
    "goal": "执行已就绪且有效授权的训练配置，验证交付物。",
    "status": "waiting_external",
    "version": 6,
    "plan_revision": 1,
    "control_epoch": 0,
    "binding_id": "binding_demo",
    "workspace_ref": "workspace_demo",
    "constraints": {
      "scope": "governed_training",
      "allow_training": true,
      "max_auto_continuations": 20,
      "deadline_at": "2026-10-20T03:00:00Z"
    },
    "completion_conditions": [
      {
        "id": "goal_training_report",
        "type": "artifact_exists",
        "parameters": {
          "artifact_role": "training_report"
        },
        "state": "pending",
        "evidence_refs": []
      }
    ],
    "plan_summary": "检查预置执行配置后，提交受治理训练并验证结果。",
    "created_at": "2026-10-19T03:00:00Z",
    "updated_at": "2026-10-19T03:02:00Z"
  },
  "stages": [
    {
      "id": "stage_readiness",
      "kind": "result.review",
      "title": "检查执行就绪证据",
      "status": "completed",
      "required": true,
      "depends_on": [],
      "input_refs": [
        "release_prebuilt_demo"
      ],
      "acceptance": [
        {
          "id": "readiness_report",
          "type": "artifact_exists",
          "parameters": {
            "artifact_role": "readiness_report"
          },
          "state": "passed",
          "evidence_refs": [
            "evidence_readiness"
          ]
        }
      ],
      "evidence_refs": [
        "evidence_readiness"
      ],
      "artifact_refs": [
        "artifact_readiness"
      ],
      "current_attempt": {
        "id": "attempt_readiness_1",
        "number": 1,
        "status": "succeeded",
        "execution_scope_id": "scope_attempt_readiness_1",
        "started_at": "2026-10-19T03:00:00Z",
        "ended_at": "2026-10-19T03:01:00Z"
      }
    },
    {
      "id": "stage_train",
      "kind": "training.run",
      "title": "训练并验证结果",
      "status": "waiting_external",
      "required": true,
      "depends_on": [
        "stage_readiness"
      ],
      "input_refs": [
        "release_prebuilt_demo",
        "artifact_readiness"
      ],
      "acceptance": [
        {
          "id": "operation_success",
          "type": "external_operation_terminal",
          "parameters": {
            "expected_status": "succeeded"
          },
          "state": "pending",
          "evidence_refs": []
        },
        {
          "id": "training_report",
          "type": "artifact_exists",
          "parameters": {
            "artifact_role": "training_report"
          },
          "state": "pending",
          "evidence_refs": []
        }
      ],
      "evidence_refs": [],
      "artifact_refs": [],
      "current_attempt": {
        "id": "attempt_train_1",
        "number": 1,
        "status": "waiting_external",
        "execution_scope_id": "scope_attempt_train_1",
        "started_at": "2026-10-19T03:01:00Z"
      },
      "wait": {
        "kind": "external",
        "id": "wait_training_demo",
        "summary": "已受理训练，等待外部终态和证据验证。",
        "operation_id": "operation_training_demo",
        "deadline_at": "2026-10-19T08:00:00Z"
      }
    }
  ],
  "artifacts": [
    {
      "id": "artifact_readiness",
      "kind": "readiness_report",
      "display_name": "readiness.json",
      "media_type": "application/json",
      "size_bytes": 2048,
      "sha256": "ffffffffffffffffffffffffffffffffffffffffffffffffffffffffffffffff",
      "locator_ref": "locator_artifact_readiness",
      "created_at": "2026-10-19T03:01:00Z"
    }
  ],
  "evidence": [
    {
      "id": "evidence_readiness",
      "source": "artifact_verifier",
      "verification": "verified",
      "sha256": "dddddddddddddddddddddddddddddddddddddddddddddddddddddddddddddddd",
      "observed_at": "2026-10-19T03:01:00Z",
      "artifact_refs": [
        "artifact_readiness"
      ],
      "operation_refs": [],
      "summary": "示例：有效预授权和不可变 Release 已由所选治理路线检查。",
      "verifier_version": "artifact-verifier/v1"
    }
  ],
  "external_operations": [
    {
      "id": "operation_training_demo",
      "provider": "governance_mcp",
      "stage_id": "stage_train",
      "attempt_id": "attempt_train_1",
      "status": "running",
      "governance_route": "governance_mcp",
      "campaign_id": "campaign_demo",
      "job_id": "job_demo",
      "run_id": "run_demo",
      "last_observed_at": "2026-10-19T03:02:00Z"
    }
  ],
  "allowed_actions": [
    "pause",
    "cancel",
    "explain"
  ],
  "last_event_seq": 14
}
